[{
  "id" : "0cb9a535-598f-4a72-8947-583545f886d0",
  "name" : "code",
  "description" : "",
  "nullable" : true,
  "trim" : true,
  "nullableValues" : [ "", "null" ],
  "metadata" : { },
  "type" : "string"
},{
  "id" : "9c5f366a-1efb-48a8-b89b-3586bae95e7e",
  "name" : "name",
  "description" : "",
  "nullable" : true,
  "trim" : true,
  "nullableValues" : [ "", "null" ],
  "metadata" : { },
  "type" : "string"
},{
  "id" : "237bc4fc-3c7a-4726-be81-b6fca6d7a1d3",
  "name" : "description",
  "description" : "",
  "nullable" : true,
  "trim" : true,
  "nullableValues" : [ "", "null" ],
  "metadata" : { },
  "type" : "string"
}]