[{
  "id" : "7a634327-6a46-4860-ac78-3f3ce90e2e12",
  "name" : "mb_2011_pid",
  "description" : "",
  "nullable" : true,
  "trim" : true,
  "nullableValues" : [ "", "null" ],
  "metadata" : { },
  "type" : "string"
},{
  "id" : "67157269-c3e9-4178-815f-311905fc9b14",
  "name" : "date_created",
  "description" : "",
  "nullable" : true,
  "trim" : true,
  "nullableValues" : [ "", "null" ],
  "metadata" : { },
  "type" : "date",
  "formatters" : [ "uuuu-MM-dd" ]
},{
  "id" : "07532860-8c89-4de8-9928-a853f247af54",
  "name" : "date_retired",
  "description" : "",
  "nullable" : true,
  "trim" : true,
  "nullableValues" : [ "", "null" ],
  "metadata" : { },
  "type" : "date",
  "formatters" : [ "uuuu-MM-dd" ]
},{
  "id" : "68bdb5c8-9dc2-4dc3-bb56-515790e58908",
  "name" : "mb_2011_code",
  "description" : "",
  "nullable" : true,
  "trim" : true,
  "nullableValues" : [ "", "null" ],
  "metadata" : { },
  "type" : "string"
}]