[{
  "id" : "7a492291-f410-46a0-a266-eae183a0b96a",
  "name" : "street_locality_pid",
  "description" : "",
  "nullable" : true,
  "trim" : true,
  "nullableValues" : [ "", "null" ],
  "metadata" : { },
  "type" : "string"
},{
  "id" : "515cda99-b9ac-44c9-a0ff-c7540dbc1165",
  "name" : "date_created",
  "description" : "",
  "nullable" : true,
  "trim" : true,
  "nullableValues" : [ "", "null" ],
  "metadata" : { },
  "type" : "date",
  "formatters" : [ "uuuu-MM-dd" ]
},{
  "id" : "158c4f2e-10ac-491e-926e-f2e54562dcf7",
  "name" : "date_retired",
  "description" : "",
  "nullable" : true,
  "trim" : true,
  "nullableValues" : [ "", "null" ],
  "metadata" : { },
  "type" : "date",
  "formatters" : [ "uuuu-MM-dd" ]
},{
  "id" : "326f7b72-9745-4d9e-98f1-c7788459546c",
  "name" : "street_class_code",
  "description" : "",
  "nullable" : true,
  "trim" : true,
  "nullableValues" : [ "", "null" ],
  "metadata" : { },
  "type" : "string"
},{
  "id" : "c18ee707-17ce-4261-beee-83465147778d",
  "name" : "street_name",
  "description" : "",
  "nullable" : true,
  "trim" : true,
  "nullableValues" : [ "", "null" ],
  "metadata" : { },
  "type" : "string"
},{
  "id" : "dbb0a980-fa00-43a7-8352-8792f049dbff",
  "name" : "street_type_code",
  "description" : "",
  "nullable" : true,
  "trim" : true,
  "nullableValues" : [ "", "null" ],
  "metadata" : { },
  "type" : "string"
},{
  "id" : "65fd4f3e-6bbb-4ed6-a710-91288be6ad4d",
  "name" : "street_suffix_code",
  "description" : "",
  "nullable" : true,
  "trim" : true,
  "nullableValues" : [ "", "null" ],
  "metadata" : { },
  "type" : "string"
},{
  "id" : "fed5a9cc-84b8-48ea-ad69-1540180894e5",
  "name" : "locality_pid",
  "description" : "",
  "nullable" : true,
  "trim" : true,
  "nullableValues" : [ "", "null" ],
  "metadata" : { },
  "type" : "string"
},{
  "id" : "1555751a-a706-415e-a31d-d91f6e827340",
  "name" : "gnaf_street_pid",
  "description" : "",
  "nullable" : true,
  "trim" : true,
  "nullableValues" : [ "", "null" ],
  "metadata" : { },
  "type" : "string"
},{
  "id" : "d6f858aa-1d19-4b5d-a28f-d076672c3c29",
  "name" : "gnaf_street_confidence",
  "description" : "",
  "nullable" : true,
  "trim" : true,
  "nullableValues" : [ "", "null" ],
  "metadata" : { },
  "type" : "integer"
},{
  "id" : "9e731c91-8bbb-488a-8016-a5e502cad8a5",
  "name" : "gnaf_reliability_code",
  "description" : "",
  "nullable" : true,
  "trim" : true,
  "nullableValues" : [ "", "null" ],
  "metadata" : { },
  "type" : "integer"
}]