[{
  "id" : "879f300c-85d9-4ed1-90ee-f3f2766fce5c",
  "name" : "code",
  "description" : "",
  "nullable" : true,
  "trim" : true,
  "nullableValues" : [ "", "null" ],
  "metadata" : { },
  "type" : "string"
},{
  "id" : "8f0be206-ffa6-4f9d-80ac-907cf8cd9b6e",
  "name" : "name",
  "description" : "",
  "nullable" : true,
  "trim" : true,
  "nullableValues" : [ "", "null" ],
  "metadata" : { },
  "type" : "string"
},{
  "id" : "9a0ae361-5118-48cd-9611-a7be1d9224f1",
  "name" : "description",
  "description" : "",
  "nullable" : true,
  "trim" : true,
  "nullableValues" : [ "", "null" ],
  "metadata" : { },
  "type" : "string"
}]