[{
  "id" : "ce669ee4-d65e-4988-b9d0-afd7eba77935",
  "name" : "address_alias_pid",
  "description" : "",
  "nullable" : true,
  "trim" : true,
  "nullableValues" : [ "", "null" ],
  "metadata" : { },
  "type" : "string"
},{
  "id" : "04885441-7124-45ca-8873-9499f30c5e1a",
  "name" : "date_created",
  "description" : "",
  "nullable" : true,
  "trim" : true,
  "nullableValues" : [ "", "null" ],
  "metadata" : { },
  "type" : "date",
  "formatters" : [ "yyyy-MM-dd" ]
},{
  "id" : "eb2c07c0-549e-4bcf-9437-232e266d3b89",
  "name" : "date_retired",
  "description" : "",
  "nullable" : true,
  "trim" : true,
  "nullableValues" : [ "", "null" ],
  "metadata" : { },
  "type" : "date",
  "formatters" : [ "yyyy-MM-dd" ]
},{
  "id" : "8697079f-37d5-4e5a-851e-665c42b09575",
  "name" : "principal_pid",
  "description" : "",
  "nullable" : true,
  "trim" : true,
  "nullableValues" : [ "", "null" ],
  "metadata" : { },
  "type" : "string"
},{
  "id" : "01967040-32eb-429e-ab9f-013acd5dc75f",
  "name" : "alias_pid",
  "description" : "",
  "nullable" : true,
  "trim" : true,
  "nullableValues" : [ "", "null" ],
  "metadata" : { },
  "type" : "string"
},{
  "id" : "3c1d47b1-f9fc-45f3-94ec-49bbaf87f06e",
  "name" : "alias_type_code",
  "description" : "",
  "nullable" : true,
  "trim" : true,
  "nullableValues" : [ "", "null" ],
  "metadata" : { },
  "type" : "string"
},{
  "id" : "f38319bf-b0b3-418c-a808-0a0bcf207177",
  "name" : "alias_comment",
  "description" : "",
  "nullable" : true,
  "trim" : true,
  "nullableValues" : [ "", "null" ],
  "metadata" : { },
  "type" : "string"
}]