[{
  "id" : "5b9cbc7d-40c2-45fa-a7a7-abbf539205a0",
  "name" : "locality_pid",
  "description" : "",
  "nullable" : true,
  "trim" : true,
  "nullableValues" : [ "", "null" ],
  "metadata" : { },
  "type" : "string"
},{
  "id" : "a583265a-b718-4fcf-a43d-4dbeaefc0e01",
  "name" : "date_created",
  "description" : "",
  "nullable" : true,
  "trim" : true,
  "nullableValues" : [ "", "null" ],
  "metadata" : { },
  "type" : "date",
  "formatters" : [ "uuuu-MM-dd" ]
},{
  "id" : "322c014c-2dec-42eb-b37b-ee3536c60526",
  "name" : "date_retired",
  "description" : "",
  "nullable" : true,
  "trim" : true,
  "nullableValues" : [ "", "null" ],
  "metadata" : { },
  "type" : "date",
  "formatters" : [ "uuuu-MM-dd" ]
},{
  "id" : "0ac3ba37-65a3-4630-928b-5ffbd268194e",
  "name" : "locality_name",
  "description" : "",
  "nullable" : true,
  "trim" : true,
  "nullableValues" : [ "", "null" ],
  "metadata" : { },
  "type" : "string"
},{
  "id" : "1ce4b78e-cd4a-461b-80d3-ea2abe81cd8d",
  "name" : "primary_postcode",
  "description" : "",
  "nullable" : true,
  "trim" : true,
  "nullableValues" : [ "", "null" ],
  "metadata" : { },
  "type" : "string"
},{
  "id" : "ae1010e2-0109-475c-a794-96b1d2428081",
  "name" : "locality_class_code",
  "description" : "",
  "nullable" : true,
  "trim" : true,
  "nullableValues" : [ "", "null" ],
  "metadata" : { },
  "type" : "string"
},{
  "id" : "89ecb919-54b4-4727-9028-0670720bc9f2",
  "name" : "state_pid",
  "description" : "",
  "nullable" : true,
  "trim" : true,
  "nullableValues" : [ "", "null" ],
  "metadata" : { },
  "type" : "string"
},{
  "id" : "c2e54026-f53e-440f-b2ed-504345a9b6ad",
  "name" : "gnaf_locality_pid",
  "description" : "",
  "nullable" : true,
  "trim" : true,
  "nullableValues" : [ "", "null" ],
  "metadata" : { },
  "type" : "string"
},{
  "id" : "815b2b54-57e8-4909-80db-684cb15563e0",
  "name" : "gnaf_reliability_code",
  "description" : "",
  "nullable" : true,
  "trim" : true,
  "nullableValues" : [ "", "null" ],
  "metadata" : { },
  "type" : "integer"
}]