[{
  "id" : "ec603d1d-2f5d-47ac-a128-b0ae6257c648",
  "name" : "code",
  "description" : "",
  "nullable" : true,
  "trim" : true,
  "nullableValues" : [ "", "null" ],
  "metadata" : { },
  "type" : "string"
},{
  "id" : "3467bcaa-f926-418c-b0bb-71023a5f8194",
  "name" : "name",
  "description" : "",
  "nullable" : true,
  "trim" : true,
  "nullableValues" : [ "", "null" ],
  "metadata" : { },
  "type" : "string"
},{
  "id" : "851b8f6e-6e55-4b71-aae1-c5a7bc352949",
  "name" : "description",
  "description" : "",
  "nullable" : true,
  "trim" : true,
  "nullableValues" : [ "", "null" ],
  "metadata" : { },
  "type" : "string"
}]