[{
  "id" : "0ae62bac-871e-4350-bec5-b7e1297a5eba",
  "name" : "locality_neighbour_pid",
  "description" : "",
  "nullable" : true,
  "trim" : true,
  "nullableValues" : [ "", "null" ],
  "metadata" : { },
  "type" : "string"
},{
  "id" : "f0c2dba3-3a99-4436-937c-49fb9fa334bc",
  "name" : "date_created",
  "description" : "",
  "nullable" : true,
  "trim" : true,
  "nullableValues" : [ "", "null" ],
  "metadata" : { },
  "type" : "date",
  "formatters" : [ "uuuu-MM-dd" ]
},{
  "id" : "6049a113-d28f-49fd-826b-6d3adcc663e7",
  "name" : "date_retired",
  "description" : "",
  "nullable" : true,
  "trim" : true,
  "nullableValues" : [ "", "null" ],
  "metadata" : { },
  "type" : "date",
  "formatters" : [ "uuuu-MM-dd" ]
},{
  "id" : "1425bba7-e271-4548-90f4-8c51fddd60ed",
  "name" : "locality_pid",
  "description" : "",
  "nullable" : true,
  "trim" : true,
  "nullableValues" : [ "", "null" ],
  "metadata" : { },
  "type" : "string"
},{
  "id" : "af6deaf2-22e9-43c3-b5c5-e5a5af9d91d0",
  "name" : "neighbour_locality_pid",
  "description" : "",
  "nullable" : true,
  "trim" : true,
  "nullableValues" : [ "", "null" ],
  "metadata" : { },
  "type" : "string"
}]