[{
  "id" : "e893d003-2c47-48ba-b5e8-4d51a5bb9351",
  "name" : "address_detail_pid",
  "description" : "",
  "nullable" : true,
  "trim" : true,
  "nullableValues" : [ "", "null" ],
  "metadata" : { },
  "type" : "string"
},{
  "id" : "67040349-2393-4529-a8a2-1b5fdfc0ca1b",
  "name" : "date_created",
  "description" : "",
  "nullable" : true,
  "trim" : true,
  "nullableValues" : [ "", "null" ],
  "metadata" : { },
  "type" : "date",
  "formatters" : [ "yyyy-MM-dd" ]
},{
  "id" : "565c8fd5-80ec-48f8-b578-e84b162b838d",
  "name" : "date_last_modified",
  "description" : "",
  "nullable" : true,
  "trim" : true,
  "nullableValues" : [ "", "null" ],
  "metadata" : { },
  "type" : "date",
  "formatters" : [ "yyyy-MM-dd" ]
},{
  "id" : "79796069-b47c-4df4-8d4d-79a62d5b2737",
  "name" : "date_retired",
  "description" : "",
  "nullable" : true,
  "trim" : true,
  "nullableValues" : [ "", "null" ],
  "metadata" : { },
  "type" : "date",
  "formatters" : [ "yyyy-MM-dd" ]
},{
  "id" : "04a2026e-4105-4413-9cff-7f4705213a5d",
  "name" : "building_name",
  "description" : "",
  "nullable" : true,
  "trim" : true,
  "nullableValues" : [ "", "null" ],
  "metadata" : { },
  "type" : "string"
},{
  "id" : "f9f58f10-c1d5-4684-9ca7-ed2ab1143aad",
  "name" : "lot_number_prefix",
  "description" : "",
  "nullable" : true,
  "trim" : true,
  "nullableValues" : [ "", "null" ],
  "metadata" : { },
  "type" : "string"
},{
  "id" : "f56c2451-c0ed-4acb-a3f3-b38472582d04",
  "name" : "lot_number",
  "description" : "",
  "nullable" : true,
  "trim" : true,
  "nullableValues" : [ "", "null" ],
  "metadata" : { },
  "type" : "string"
},{
  "id" : "249b6931-f6cd-485a-97f7-fac9a9f5fc21",
  "name" : "lot_number_suffix",
  "description" : "",
  "nullable" : true,
  "trim" : true,
  "nullableValues" : [ "", "null" ],
  "metadata" : { },
  "type" : "string"
},{
  "id" : "f4502387-be2d-424d-bf13-0566aebd35f3",
  "name" : "flat_type_code",
  "description" : "",
  "nullable" : true,
  "trim" : true,
  "nullableValues" : [ "", "null" ],
  "metadata" : { },
  "type" : "string"
},{
  "id" : "31c2cb77-9326-4a63-9e70-3c1dc0fe70b3",
  "name" : "flat_number_prefix",
  "description" : "",
  "nullable" : true,
  "trim" : true,
  "nullableValues" : [ "", "null" ],
  "metadata" : { },
  "type" : "string"
},{
  "id" : "72e2f4b5-8014-46fd-910d-370408be5a6a",
  "name" : "flat_number",
  "description" : "",
  "nullable" : true,
  "trim" : true,
  "nullableValues" : [ "", "null" ],
  "metadata" : { },
  "type" : "integer"
},{
  "id" : "1fb00e20-8589-4918-b2a9-7756589e7ba7",
  "name" : "flat_number_suffix",
  "description" : "",
  "nullable" : true,
  "trim" : true,
  "nullableValues" : [ "", "null" ],
  "metadata" : { },
  "type" : "string"
},{
  "id" : "d426af0f-c8ec-4c99-a62a-b76aa5742afc",
  "name" : "level_type_code",
  "description" : "",
  "nullable" : true,
  "trim" : true,
  "nullableValues" : [ "", "null" ],
  "metadata" : { },
  "type" : "string"
},{
  "id" : "b5d2158c-9506-4ddc-bd26-2a83bf32bbed",
  "name" : "level_number_prefix",
  "description" : "",
  "nullable" : true,
  "trim" : true,
  "nullableValues" : [ "", "null" ],
  "metadata" : { },
  "type" : "string"
},{
  "id" : "5d5460a3-1725-4600-b8f9-7f7cda06d830",
  "name" : "level_number",
  "description" : "",
  "nullable" : true,
  "trim" : true,
  "nullableValues" : [ "", "null" ],
  "metadata" : { },
  "type" : "integer"
},{
  "id" : "d5081543-e940-4802-b2f6-47ab19828202",
  "name" : "level_number_suffix",
  "description" : "",
  "nullable" : true,
  "trim" : true,
  "nullableValues" : [ "", "null" ],
  "metadata" : { },
  "type" : "string"
},{
  "id" : "4ea95241-af76-4531-ae96-a75b72aedef3",
  "name" : "number_first_prefix",
  "description" : "",
  "nullable" : true,
  "trim" : true,
  "nullableValues" : [ "", "null" ],
  "metadata" : { },
  "type" : "string"
},{
  "id" : "97a6a231-52cf-4687-b445-a73eb9cca6ff",
  "name" : "number_first",
  "description" : "",
  "nullable" : true,
  "trim" : true,
  "nullableValues" : [ "", "null" ],
  "metadata" : { },
  "type" : "integer"
},{
  "id" : "65b9f88e-951f-4175-b717-1914d887291c",
  "name" : "number_first_suffix",
  "description" : "",
  "nullable" : true,
  "trim" : true,
  "nullableValues" : [ "", "null" ],
  "metadata" : { },
  "type" : "string"
},{
  "id" : "ade60691-66de-4202-b7ce-c68d7a201331",
  "name" : "number_last_prefix",
  "description" : "",
  "nullable" : true,
  "trim" : true,
  "nullableValues" : [ "", "null" ],
  "metadata" : { },
  "type" : "string"
},{
  "id" : "4f213e5b-ce32-438f-b8bc-9c828da2b3f2",
  "name" : "number_last",
  "description" : "",
  "nullable" : true,
  "trim" : true,
  "nullableValues" : [ "", "null" ],
  "metadata" : { },
  "type" : "integer"
},{
  "id" : "1915d454-c573-44f3-b94c-847b12f27319",
  "name" : "number_last_suffix",
  "description" : "",
  "nullable" : true,
  "trim" : true,
  "nullableValues" : [ "", "null" ],
  "metadata" : { },
  "type" : "string"
},{
  "id" : "fa3ae0ae-fb1a-4be7-9c12-09d144cc86a0",
  "name" : "street_locality_pid",
  "description" : "",
  "nullable" : true,
  "trim" : true,
  "nullableValues" : [ "", "null" ],
  "metadata" : { },
  "type" : "string"
},{
  "id" : "e67725a4-6802-4b53-8d2a-6b91e9265ab9",
  "name" : "location_description",
  "description" : "",
  "nullable" : true,
  "trim" : true,
  "nullableValues" : [ "", "null" ],
  "metadata" : { },
  "type" : "string"
},{
  "id" : "6484dbd1-1a63-47fe-bd0c-41242dcddc7f",
  "name" : "locality_pid",
  "description" : "",
  "nullable" : true,
  "trim" : true,
  "nullableValues" : [ "", "null" ],
  "metadata" : { },
  "type" : "string"
},{
  "id" : "ca44f1ae-7e6e-4984-b6b8-98777b2ed549",
  "name" : "alias_principal",
  "description" : "",
  "nullable" : true,
  "trim" : true,
  "nullableValues" : [ "", "null" ],
  "metadata" : { },
  "type" : "string"
},{
  "id" : "3ca66458-4ac2-4fdd-9c35-7630eeae0b52",
  "name" : "postcode",
  "description" : "",
  "nullable" : true,
  "trim" : true,
  "nullableValues" : [ "", "null" ],
  "metadata" : { },
  "type" : "string"
},{
  "id" : "6609f530-f7ae-486a-9924-a3c39f04ba6a",
  "name" : "private_street",
  "description" : "",
  "nullable" : true,
  "trim" : true,
  "nullableValues" : [ "", "null" ],
  "metadata" : { },
  "type" : "string"
},{
  "id" : "69535c8e-b684-4ab5-9d52-d33c9b4b8b63",
  "name" : "legal_parcel_id",
  "description" : "",
  "nullable" : true,
  "trim" : true,
  "nullableValues" : [ "", "null" ],
  "metadata" : { },
  "type" : "string"
},{
  "id" : "d14bde43-ced5-410b-be16-9b6f29e920ea",
  "name" : "confidence",
  "description" : "",
  "nullable" : true,
  "trim" : true,
  "nullableValues" : [ "", "null" ],
  "metadata" : { },
  "type" : "integer"
},{
  "id" : "e85e65f2-298e-44cd-a566-73df24259be1",
  "name" : "address_site_pid",
  "description" : "",
  "nullable" : true,
  "trim" : true,
  "nullableValues" : [ "", "null" ],
  "metadata" : { },
  "type" : "string"
},{
  "id" : "d6576cdb-f415-41b6-b891-c37df05bfb36",
  "name" : "level_geocoded_code",
  "description" : "",
  "nullable" : true,
  "trim" : true,
  "nullableValues" : [ "", "null" ],
  "metadata" : { },
  "type" : "integer"
},{
  "id" : "fc453e76-a206-4135-a942-41bdb99244f1",
  "name" : "property_pid",
  "description" : "",
  "nullable" : true,
  "trim" : true,
  "nullableValues" : [ "", "null" ],
  "metadata" : { },
  "type" : "string"
},{
  "id" : "3b2fea9f-2a52-4fd5-b3b3-61657dd11533",
  "name" : "gnaf_property_pid",
  "description" : "",
  "nullable" : true,
  "trim" : true,
  "nullableValues" : [ "", "null" ],
  "metadata" : { },
  "type" : "string"
},{
  "id" : "e09c6d40-cc03-4a34-8180-ce1259da9a54",
  "name" : "primary_secondary",
  "description" : "",
  "nullable" : true,
  "trim" : true,
  "nullableValues" : [ "", "null" ],
  "metadata" : { },
  "type" : "string"
}]