[{
  "id" : "8f6403fd-f687-4265-9303-b2c92a7625b5",
  "name" : "address_site_pid",
  "description" : "",
  "nullable" : true,
  "trim" : true,
  "nullableValues" : [ "", "null" ],
  "metadata" : { },
  "type" : "string"
},{
  "id" : "61af1fd2-4466-4a67-9bcf-a7ce6d683e4b",
  "name" : "date_created",
  "description" : "",
  "nullable" : true,
  "trim" : true,
  "nullableValues" : [ "", "null" ],
  "metadata" : { },
  "type" : "date",
  "formatters" : [ "yyyy-MM-dd" ]
},{
  "id" : "92267f85-b86b-4f8e-8f20-ae4a57c80a97",
  "name" : "date_retired",
  "description" : "",
  "nullable" : true,
  "trim" : true,
  "nullableValues" : [ "", "null" ],
  "metadata" : { },
  "type" : "date",
  "formatters" : [ "yyyy-MM-dd" ]
},{
  "id" : "61f55f99-9bf1-42c3-a46e-a6b599aedc50",
  "name" : "address_type",
  "description" : "",
  "nullable" : true,
  "trim" : true,
  "nullableValues" : [ "", "null" ],
  "metadata" : { },
  "type" : "string"
},{
  "id" : "7288906e-065e-4906-b0c0-a6d6b3de19f9",
  "name" : "address_site_name",
  "description" : "",
  "nullable" : true,
  "trim" : true,
  "nullableValues" : [ "", "null" ],
  "metadata" : { },
  "type" : "string"
}]